{
  "$schema": "https://json-schema.org/draft/2020-12/schema",
  "$id": "https://loopwhole.local/session.schema.json",
  "title": "Loopwhole Session Dump",
  "type": "object",
  "required": ["session", "totals", "toolCalls"],
  "properties": {
    "formatVersion": { "type": "integer", "const": 1 },
    "session": {
      "type": "object",
      "required": [
        "id",
        "startedAtMs",
        "endedAtMs",
        "workspaceRoot",
        "tokenCounter"
      ],
      "properties": {
        "id": { "type": "string", "pattern": "^[A-Za-z0-9._-]+$" },
        "startedAtMs": { "type": "integer" },
        "endedAtMs": { "type": "integer" },
        "workspaceRoot": { "type": "string" },
        "contextWindowTokens": { "type": ["integer", "null"], "minimum": 0 },
        "tokenCounter": { "type": "string" }
      },
      "additionalProperties": false
    },
    "totals": {
      "type": "object",
      "required": [
        "toolInputTokens",
        "originalOutputTokens",
        "interceptedOutputTokens",
        "withoutRuntimeTokens",
        "withRuntimeTokens",
        "savedTokens",
        "savingsPercent"
      ],
      "properties": {
        "toolInputTokens": { "type": "integer", "minimum": 0 },
        "originalToolInputTokens": { "type": "integer", "minimum": 0 },
        "originalOutputTokens": { "type": "integer", "minimum": 0 },
        "interceptedOutputTokens": { "type": "integer", "minimum": 0 },
        "withoutRuntimeTokens": { "type": "integer", "minimum": 0 },
        "withRuntimeTokens": { "type": "integer", "minimum": 0 },
        "savedTokens": { "type": "integer" },
        "savingsPercent": { "type": "number" },
        "withoutRuntimeContextPercent": { "type": ["number", "null"] },
        "withRuntimeContextPercent": { "type": ["number", "null"] }
      },
      "additionalProperties": false
    },
    "toolCalls": {
      "type": "array",
      "items": {
        "type": "object",
        "required": [
          "id",
          "sequence",
          "occurredAtMs",
          "toolName",
          "status",
          "durationMs",
          "deliveryMode",
          "input",
          "original",
          "intercepted"
        ],
        "properties": {
          "id": { "type": "integer", "minimum": 1 },
          "sequence": { "type": "integer", "minimum": 1 },
          "occurredAtMs": { "type": "integer" },
          "toolName": { "type": "string" },
          "subjectPath": { "type": ["string", "null"] },
          "status": { "type": "string" },
          "durationMs": { "type": "integer", "minimum": 0 },
          "deliveryMode": { "type": "string" },
          "decisionReason": { "type": ["string", "null"] },
          "baselineHash": { "type": ["string", "null"] },
          "currentHash": { "type": ["string", "null"] },
          "input": {},
          "originalInputTokens": { "type": "integer", "minimum": 0 },
          "original": { "$ref": "#/$defs/toolPayload" },
          "intercepted": { "$ref": "#/$defs/toolPayload" }
        },
        "additionalProperties": false
      }
    },
    "baselines": {
      "type": "object",
      "required": ["reads", "commands"],
      "properties": {
        "reads": {
          "type": "array",
          "items": { "$ref": "#/$defs/readBaseline" }
        },
        "commands": {
          "type": "array",
          "items": { "$ref": "#/$defs/commandBaseline" }
        }
      },
      "additionalProperties": false
    }
  },
  "$defs": {
    "toolPayload": {
      "type": "object",
      "required": ["text", "bytes", "tokens"],
      "properties": {
        "text": { "type": "string" },
        "bytes": { "type": "integer", "minimum": 0 },
        "tokens": { "type": "integer", "minimum": 0 }
      },
      "additionalProperties": false
    },
    "readBaseline": {
      "type": "object",
      "required": [
        "path",
        "offset",
        "limit",
        "text",
        "viewHash",
        "fileHash",
        "wasTruncated"
      ],
      "properties": {
        "path": { "type": "string" },
        "offset": { "type": "integer", "minimum": 1 },
        "limit": { "type": ["integer", "null"], "minimum": 0 },
        "text": { "type": "string" },
        "viewHash": { "type": "string" },
        "fileHash": { "type": "string" },
        "wasTruncated": { "type": "boolean" }
      },
      "additionalProperties": false
    },
    "commandBaseline": {
      "type": "object",
      "required": [
        "program",
        "args",
        "cwd",
        "exitCode",
        "rawOutputHash",
        "canonicalText",
        "canonicalHash",
        "outputWasTruncated",
        "adapterKind"
      ],
      "properties": {
        "program": { "type": "string" },
        "args": { "type": "array", "items": { "type": "string" } },
        "cwd": { "type": "string" },
        "stdin": { "type": ["string", "null"] },
        "exitCode": { "type": "integer" },
        "rawOutputHash": { "type": "string" },
        "canonicalText": { "type": "string" },
        "canonicalHash": { "type": "string" },
        "outputWasTruncated": { "type": "boolean" },
        "adapterKind": { "type": "string" }
      },
      "additionalProperties": false
    }
  },
  "additionalProperties": false
}
