{
  "formatVersion": 1,
  "session": {
    "id": "loopey-demo",
    "startedAtMs": 1774267200000,
    "endedAtMs": 1774267212000,
    "workspaceRoot": "/home/dev/warp-mcp-gateway",
    "contextWindowTokens": 200000,
    "tokenCounter": "chars_div_4_v1"
  },
  "totals": {
    "toolInputTokens": 316,
    "originalOutputTokens": 3923,
    "interceptedOutputTokens": 1654,
    "withoutRuntimeTokens": 4239,
    "withRuntimeTokens": 1970,
    "savedTokens": 2269,
    "savingsPercent": 53.53,
    "withoutRuntimeContextPercent": 2.12,
    "withRuntimeContextPercent": 0.98
  },
  "toolCalls": [
    {
      "id": 1,
      "sequence": 1,
      "occurredAtMs": 1774267201000,
      "toolName": "read",
      "subjectPath": "src/main.rs",
      "status": "success",
      "durationMs": 5,
      "deliveryMode": "full",
      "decisionReason": "no_baseline_observed",
      "baselineHash": null,
      "currentHash": "sha256:62ac7c399d39",
      "input": {
        "path": "src/main.rs"
      },
      "original": {
        "text": "use std::sync::Arc;\n\nuse anyhow::Result;\nuse clap::Parser;\n\nuse crate::gateway::Gateway;\nuse crate::store::SessionStore;\n\n#[derive(Debug, Parser)]\nstruct Args {\n    #[arg(long, default_value = \".\")]\n    root: std::path::PathBuf,\n    #[arg(long, default_value = \"127.0.0.1:8787\")]\n    api_addr: std::net::SocketAddr,\n    #[arg(long)]\n    session_id: Option<String>,\n    #[arg(long)]\n    context_window_tokens: Option<u64>,\n}\n\n#[tokio::main]\nasync fn main() -> Result<()> {\n    let args = Args::parse();\n    let store = SessionStore::new(session_summary(&args));\n    let gateway = Gateway::new(store.clone());\n    serve_api(args.api_addr, store.clone()).await?;\n    gateway.serve_stdio().await?;\n    store.persist_on_shutdown().await?;\n    Ok(())\n}\nuse std::sync::Arc;\n\nuse anyhow::Result;\nuse clap::Parser;\n\nuse crate::gateway::Gateway;\nuse crate::store::SessionStore;\n\n#[derive(Debug, Parser)]\nstruct Args {\n    #[arg(long, default_value = \".\")]\n    root: std::path::PathBuf,\n    #[arg(long, default_value = \"127.0.0.1:8787\")]\n    api_addr: std::net::SocketAddr,\n    #[arg(long)]\n    session_id: Option<String>,\n    #[arg(long)]\n    context_window_tokens: Option<u64>,\n}\n\n#[tokio::main]\nasync fn main() -> Result<()> {\n    let args = Args::parse();\n    let store = SessionStore::new(session_summary(&args));\n    let gateway = Gateway::new(store.clone());\n    serve_api(args.api_addr, store.clone()).await?;\n    gateway.serve_stdio().await?;\n    store.persist_on_shutdown().await?;\n    Ok(())\n}\nuse std::sync::Arc;\n\nuse anyhow::Result;\nuse clap::Parser;\n\nuse crate::gateway::Gateway;\nuse crate::store::SessionStore;\n\n#[derive(Debug, Parser)]\nstruct Args {\n    #[arg(long, default_value = \".\")]\n    root: std::path::PathBuf,\n    #[arg(long, default_value = \"127.0.0.1:8787\")]\n    api_addr: std::net::SocketAddr,\n    #[arg(long)]\n    session_id: Option<String>,\n    #[arg(long)]\n    context_window_tokens: Option<u64>,\n}\n\n#[tokio::main]\nasync fn main() -> Result<()> {\n    let args = Args::parse();\n    let store = SessionStore::new(session_summary(&args));\n    let gateway = Gateway::new(store.clone());\n    serve_api(args.api_addr, store.clone()).await?;\n    gateway.serve_stdio().await?;\n    store.persist_on_shutdown().await?;\n    Ok(())\n}\n",
        "bytes": 2241,
        "tokens": 561
      },
      "intercepted": {
        "text": "use std::sync::Arc;\n\nuse anyhow::Result;\nuse clap::Parser;\n\nuse crate::gateway::Gateway;\nuse crate::store::SessionStore;\n\n#[derive(Debug, Parser)]\nstruct Args {\n    #[arg(long, default_value = \".\")]\n    root: std::path::PathBuf,\n    #[arg(long, default_value = \"127.0.0.1:8787\")]\n    api_addr: std::net::SocketAddr,\n    #[arg(long)]\n    session_id: Option<String>,\n    #[arg(long)]\n    context_window_tokens: Option<u64>,\n}\n\n#[tokio::main]\nasync fn main() -> Result<()> {\n    let args = Args::parse();\n    let store = SessionStore::new(session_summary(&args));\n    let gateway = Gateway::new(store.clone());\n    serve_api(args.api_addr, store.clone()).await?;\n    gateway.serve_stdio().await?;\n    store.persist_on_shutdown().await?;\n    Ok(())\n}\nuse std::sync::Arc;\n\nuse anyhow::Result;\nuse clap::Parser;\n\nuse crate::gateway::Gateway;\nuse crate::store::SessionStore;\n\n#[derive(Debug, Parser)]\nstruct Args {\n    #[arg(long, default_value = \".\")]\n    root: std::path::PathBuf,\n    #[arg(long, default_value = \"127.0.0.1:8787\")]\n    api_addr: std::net::SocketAddr,\n    #[arg(long)]\n    session_id: Option<String>,\n    #[arg(long)]\n    context_window_tokens: Option<u64>,\n}\n\n#[tokio::main]\nasync fn main() -> Result<()> {\n    let args = Args::parse();\n    let store = SessionStore::new(session_summary(&args));\n    let gateway = Gateway::new(store.clone());\n    serve_api(args.api_addr, store.clone()).await?;\n    gateway.serve_stdio().await?;\n    store.persist_on_shutdown().await?;\n    Ok(())\n}\nuse std::sync::Arc;\n\nuse anyhow::Result;\nuse clap::Parser;\n\nuse crate::gateway::Gateway;\nuse crate::store::SessionStore;\n\n#[derive(Debug, Parser)]\nstruct Args {\n    #[arg(long, default_value = \".\")]\n    root: std::path::PathBuf,\n    #[arg(long, default_value = \"127.0.0.1:8787\")]\n    api_addr: std::net::SocketAddr,\n    #[arg(long)]\n    session_id: Option<String>,\n    #[arg(long)]\n    context_window_tokens: Option<u64>,\n}\n\n#[tokio::main]\nasync fn main() -> Result<()> {\n    let args = Args::parse();\n    let store = SessionStore::new(session_summary(&args));\n    let gateway = Gateway::new(store.clone());\n    serve_api(args.api_addr, store.clone()).await?;\n    gateway.serve_stdio().await?;\n    store.persist_on_shutdown().await?;\n    Ok(())\n}\n",
        "bytes": 2241,
        "tokens": 561
      }
    },
    {
      "id": 2,
      "sequence": 2,
      "occurredAtMs": 1774267202000,
      "toolName": "read",
      "subjectPath": "src/store.rs",
      "status": "success",
      "durationMs": 6,
      "deliveryMode": "full",
      "decisionReason": "no_baseline_observed",
      "baselineHash": null,
      "currentHash": "sha256:d1b2eceefac8",
      "input": {
        "path": "src/store.rs"
      },
      "original": {
        "text": "use std::sync::{Arc, RwLock};\n\nuse crate::schema::{NewToolCall, SessionSnapshot, TokenTotals, ToolCallSummary};\n\n#[derive(Debug, Clone)]\npub struct SessionStore {\n    inner: Arc<RwLock<StoreData>>,\n}\n\nimpl SessionStore {\n    pub fn record(&self, call: NewToolCall) -> i64 {\n        let mut store = self.inner.write().expect(\"lock poisoned\");\n        let id = store.next_id;\n        store.next_id += 1;\n        store.tool_calls.push(StoredToolCall { id, call });\n        id\n    }\n\n    pub fn snapshot(&self) -> SessionSnapshot {\n        let store = self.inner.read().expect(\"lock poisoned\");\n        let input = store.tool_calls.iter().map(|c| c.call.input_tokens).sum();\n        let original = store.tool_calls.iter().map(|c| c.call.original_output_tokens).sum();\n        let intercepted = store.tool_calls.iter().map(|c| c.call.intercepted_output_tokens).sum();\n        SessionSnapshot::new(store.session.clone(), input, original, intercepted)\n    }\n}\nuse std::sync::{Arc, RwLock};\n\nuse crate::schema::{NewToolCall, SessionSnapshot, TokenTotals, ToolCallSummary};\n\n#[derive(Debug, Clone)]\npub struct SessionStore {\n    inner: Arc<RwLock<StoreData>>,\n}\n\nimpl SessionStore {\n    pub fn record(&self, call: NewToolCall) -> i64 {\n        let mut store = self.inner.write().expect(\"lock poisoned\");\n        let id = store.next_id;\n        store.next_id += 1;\n        store.tool_calls.push(StoredToolCall { id, call });\n        id\n    }\n\n    pub fn snapshot(&self) -> SessionSnapshot {\n        let store = self.inner.read().expect(\"lock poisoned\");\n        let input = store.tool_calls.iter().map(|c| c.call.input_tokens).sum();\n        let original = store.tool_calls.iter().map(|c| c.call.original_output_tokens).sum();\n        let intercepted = store.tool_calls.iter().map(|c| c.call.intercepted_output_tokens).sum();\n        SessionSnapshot::new(store.session.clone(), input, original, intercepted)\n    }\n}\nuse std::sync::{Arc, RwLock};\n\nuse crate::schema::{NewToolCall, SessionSnapshot, TokenTotals, ToolCallSummary};\n\n#[derive(Debug, Clone)]\npub struct SessionStore {\n    inner: Arc<RwLock<StoreData>>,\n}\n\nimpl SessionStore {\n    pub fn record(&self, call: NewToolCall) -> i64 {\n        let mut store = self.inner.write().expect(\"lock poisoned\");\n        let id = store.next_id;\n        store.next_id += 1;\n        store.tool_calls.push(StoredToolCall { id, call });\n        id\n    }\n\n    pub fn snapshot(&self) -> SessionSnapshot {\n        let store = self.inner.read().expect(\"lock poisoned\");\n        let input = store.tool_calls.iter().map(|c| c.call.input_tokens).sum();\n        let original = store.tool_calls.iter().map(|c| c.call.original_output_tokens).sum();\n        let intercepted = store.tool_calls.iter().map(|c| c.call.intercepted_output_tokens).sum();\n        SessionSnapshot::new(store.session.clone(), input, original, intercepted)\n    }\n}\n",
        "bytes": 2859,
        "tokens": 715
      },
      "intercepted": {